P/ECO,PINCELETA ECONOMICA (ACCESORIOS),760.00,ACF
P/ECOBCA,PINCELETA ECONOMICA BCA (ACCESORIOS),828.00,ACF
LIJ/NPECO,LIJA NO PAST ECO (ACCESORIOS),155.00,ACF
ESM/ECO,TELA ESMERIL ECO (ACCESORIOS),230.00,ACF
FIJ18,CINTA PAPEL FIJAPEL 18 (ACCESORIOS),573.00,ACF
FIJ24,CINTA PAPEL FIJAPEL 24 (ACCESORIOS),765.00,ACF
FIJ36,CINTA PAPEL FIJAPEL 36 (ACCESORIOS),1146.00,ACF
FIJ48,CINTA PAPEL FIJAPEL 48 (ACCESORIOS),1526.00,ACF
EPM1,"ESPATULA METAL 1"" 1,5"" (ACCESORIOS)",811.00,ACF
EPM2,"ESPATULA METAL 2"" (ACCESORIOS)",458.00,ACF
EPM3,"ESPATULA METAL 3"" (ACCESORIOS)",512.00,ACF
EPM4,"ESPATULA METAL 4"" (ACCESORIOS)",570.00,ACF
EPM5,"ESPATULA METAL 5"" (ACCESORIOS)",847.00,ACF
EPM6,"ESPATULA METAL 6"" (ACCESORIOS)",860.00,ACF
EP/C,ESPATULA PLASTICO CHICA (ACCESORIOS),66.00,ACF
EP/G,ESPATULA PLASTICO GRANDE (ACCESORIOS),110.00,ACF
EP/Y,ESPATULA YESERO (ACCESORIOS),121.00,ACF
EG/CH,ESPATULA GOMA CHICA (ACCESORIOS),185.00,ACF
EG/M,ESPATULA GOMA MEDIANA (ACCESORIOS),259.00,ACF
EG/G,ESPATULA GOMA GRANDE (ACCESORIOS),300.00,ACF
ALB30,ENTONADOR ALBA X30 CC (ACCESORIOS),245.00,ACF
ALB120,ENTONADOR ALBA X120 CC (ACCESORIOS),825.00,ACF
BAN1,BANDEJA MINI (ACCESORIOS),110.00,ACF
BAN2,BANDEJA COLGAR C/REJILLA (ACCESORIOS),338.00,ACF
BAN3,RODILLO BANDEJA PLANA (ACCESORIOS),304.00,ACF
AUT1,AUTOPOLISH CLÁSICO (ACCESORIOS),1625.00,ACF
AUT2,AUTOPOLISH CERA (ACCESORIOS),1625.00,ACF
AUT3,AUTOPOLISH BICAPA (ACCESORIOS),1962.00,ACF
KP250,KIT PARCHE X250 (ACCESORIOS),2825.00,ACF
VD10,VENDA 0.10 X 25 (ACCESORIOS),178.00,ACF
VD20,VENDA 0.20 X 25 (ACCESORIOS),335.00,ACF
VD1,VENDA 1.00 X 25 (ACCESORIOS),1497.00,ACF
EST,ESTOPA X300 (ACCESORIOS),355.00,ACF
LLAN12,LLANA12X30 (ACCESORIOS),926.00,ACF
LAM10,LAMINA 8X10 (ACCESORIOS),325.00,ACF
LAM12,LAMINA 8X12 (ACCESORIOS),392.00,ACF
GENG,GUANTE ENGOMADO (ACCESORIOS),670.00,ACF
KP500,KIT PARCHE X500 (ACCESORIOS),4578.00,ACF
CET/B1,CETOL BRILL X 1 (CETOL),4440.00,ACF
CET/B4,CETOL BRILL X 4 (CETOL),16981.00,ACF
CET/S1,CETOL SATINADO X 1 (CETOL),3385.00,ACF
CET/S4,CETOL SATINADO X 4 (CETOL),12935.00,ACF
TIN60,TINTA CETOL X60 (CETOL),540.00,ACF
TIN240,TINTA CETOL X240 (CETOL),1565.00,ACF
LIJ/A,LIJA AGUA DOBLE A (DOBLE A),235.00,ACF
LIJ/R,LIJA RUBI DOBLE A (DOBLE A),152.00,ACF
LIJ/NP,LIJA NO PAST DOBLE A (DOBLE A),365.00,ACF
CIN12,CINTA DE PAPEL AA 12 (DOBLE A),487.00,ACF
CIN18,CINTA DE PAPEL AA 18 (DOBLE A),610.00,ACF
CIN24,CINTA DE PAPEL AA 24 (DOBLE A),813.00,ACF
CIN36,CINTA DE PAPEL AA 36 (DOBLE A),1228.00,ACF
CIN48,CINTA DE PAPEL AA 48 (DOBLE A),1631.00,ACF
AZ18,CINTA AZUL 18 (DOBLE A),832.00,ACF
AZ24,CINTA AZUL 24 (DOBLE A),1105.00,ACF
AZ36,CINTA AZUL 36 (DOBLE A),1655.00,ACF
AZ48,CINTA AZUL 48 (DOBLE A),2210.00,ACF
AIS10,CINTA AISLADORA X10 MTS (DOBLE A),310.00,ACF
AIS20,CINTA AISLADORA X20 MTS (DOBLE A),522.00,ACF
CINT,CINTA TRAMADA P/ DURLOCK (DOBLE A),1500.00,ACF
DUCT,CINTA DUCT TAPE AA (DOBLE A),1672.00,ACF
FLAP,DISCO FLAP AA (DOBLE A),600.00,ACF
TR/AA,CINTA TRANSPARENTE AA X40 MTS (DOBLE A),575.00,ACF
DUR250S,PINTURA DURACRIL BCO/NEGRO SATINADO X250 (DURACRIL),690.00,ACF
DUR250M,PINTURA DURACRIL BCO/NEGRO MATE X250 (DURACRIL),712.00,ACF
DUR500S,PINTURA DURACRIL BCO/NEGRO SATINADO X500 (DURACRIL),1003.00,ACF
LE10,RODILLO LANA ECO 10 CM (EL RODILLO),1115.66,ACF
LE17,RODILLO LANA ECO 17 CM (EL RODILLO),1402.94,ACF
LE22,RODILLO LANA ECO 22 CM (EL RODILLO),1579.74,ACF
LN22,RODILLO LANA NATURAL SUPER 22 CM (EL RODILLO),1869.35,ACF
SL17,RODILLO RODILLO SIMIL LANA 17 CM (EL RODILLO),870.33,ACF
SL22,RODILLO RODILLO SIMIL LANA 22 CM (EL RODILLO),970.75,ACF
ESP17,RODILLO ESPUMA 17 CM (EL RODILLO),771.72,ACF
ESP22,RODILLO ESPUMA 22 CM (EL RODILLO),844.75,ACF
FOR5,RODILLO FORRADOS 5 CM (EL RODILLO),185.30,ACF
FOR8,RODILLO FORRADOS 8 CM (EL RODILLO),210.37,ACF
FOR11,RODILLO FORRADOS 11 CM (EL RODILLO),228.90,ACF
FOR17,RODILLO FORRADOS 17CM (EL RODILLO),817.53,ACF
FOR22,RODILLO FORRADOS 22CM (EL RODILLO),898.98,ACF
EP17,RODILLO EPOXI 17 CM (EL RODILLO),694.60,ACF
EP22,RODILLO EPOXI 22 CM (EL RODILLO),851.07,ACF
AT5,RODILLO ANTIGOTA 5 (EL RODILLO),220.18,ACF
AT8,RODILLO ANTIGOTA8 (EL RODILLO),256.15,ACF
AT11,RODILLO ANTIGOTA 11 (EL RODILLO),292.12,ACF
AT10,RODILLO ANTIGOTA 10 CM (EL RODILLO),689.99,ACF
AT17,RODILLO ANTIGOTA 17 CM (EL RODILLO),869.78,ACF
AT22,RODILLO ANTIGOTA 22 CM (EL RODILLO),995.79,ACF
TAC280,SILICONA ACETICA TRANSP. X280 (FERRETERIA),2105.00,ACF
TAC50,SILICONA ACETICA TRANSP X50 BLISTER (FERRETERIA),975.00,ACF
LABOR300,RODILLO ESPUMA POLIURETANICA X300 (FERRETERIA),2050.00,ACF
CH13,"CAJA HERR. C/BANDEJA Y GAVETERO 13"" (FERRETERIA)",2710.00,ACF
CH16,"CAJA HERR. C/BANDEJA Y GAVETERO 16"" (FERRETERIA)",4150.00,ACF
CH19,"CAJA HERR. C/BANDEJA Y GAVETERO 19"" (FERRETERIA)",4600.00,ACF
MP500,MASILLA PLASTICA X ½ (FERRETERIA),2232.00,ACF
MP1000,MASILLA PLASTICA X1 (FERRETERIA),2875.00,ACF
CM3,CINTA METRICA X3 MTS (FERRETERIA),852.00,ACF
CM5,CINTA METRICA X5 MTS (FERRETERIA),1112.00,ACF
CM75,CINTA METRICA X7.5MTS (FERRETERIA),2310.00,ACF
COL250,COLA VINILICA X250CC (FERRETERIA),583.00,ACF
COL500,COLA VINILICA X500CC (FERRETERIA),1015.00,ACF
GAS,GAS BUTANO (FERRETERIA),878.00,ACF
ZAP1,ZAPATILLA 1.5 MTS (FERRETERIA),1135.00,ACF
ZAP3,ZAPATILLA 3 MTS (FERRETERIA),1416.00,ACF
ZAP5,ZAPATILLA 5 MTS (FERRETERIA),1700.00,ACF
SILL1,SILLON FIJO (FERRETERIA),13501.00,ACF
SILL5,SILLO 5 POS (FERRETERIA),17010.00,ACF
REF10,REFLECTOR LED 10W (FERRETERIA),1890.00,ACF
REF20,REFLECTOR LED 20W (FERRETERIA),2618.00,ACF
REF30,REFLECTOR LED 30W (FERRETERIA),2922.00,ACF
REF50,REFLECTOR LED 50W (FERRETERIA),5737.00,ACF
REF100,REFLECTOR LED 100W (FERRETERIA),8048.00,ACF
REF200,REFLECTOR LED 200W (FERRETERIA),1841.00,ACF
BAL,BALDE ALBAÑIL REFORZADO (FERRETERIA),498.00,ACF
ENC/EXT,"ENCENDEDOR EXTENSIBLE ""CANDELA"" (FERRETERIA)",690.00,ACF
EM/30,LUZ EMERGENCIA 30 LED (FERRETERIA),4845.00,ACF
EM/60,LUZ EMERGENCIA 60 LED (FERRETERIA),7570.00,ACF
TIMBRE,TIMBRE INALAMBRICO (FERRETERIA),2400.00,ACF
FE20,RODILLO FRATACHO ESPUMA 20 (FERRETERIA),181.00,ACF
FE25,RODILLO FRATACHO ESPUMA 25 (FERRETERIA),202.00,ACF
FE30,RODILLO FRATACHO ESPUMA 30 (FERRETERIA),220.00,ACF
PVC/R,CAJA RECTANGULAR PVC (FERRETERIA),64.00,ACF
PVC/O,CAJA OCTOGONAL PVC (FERRETERIA),64.00,ACF
TAR6,TARUGO CON TOPE NRO 6 X2000 (FERRETERIA),3235.00,ACF
TAR8,TARUGO CON TOPE NRO 8 X1000 (FERRETERIA),32325.00,ACF
TAR10,TARUGO CON TOPE NRO 10 X500 (FERRETERIA),3235.00,ACF
SJR,SIERRA JUNIOR (FERRETERIA),288.00,ACF
ZOC080,"ZOCALO ALUMINIO 0,80 (FERRETERIA)",671.00,ACF
ZOC090,"ZOCALO ALUMINIO 0,90 (FERRETERIA)",766.00,ACF
ZOC1,ZOCALO ALUMINIO 1 MTS (FERRETERIA),842.00,ACF
BAR/LUJO,BARRAL EXTENSIBLE ALUMINIO (LUJO) (FERRETERIA),3007.00,ACF
BAR/COM,BARRAL EXTENSIBLE ALUMINIO (FERRETERIA),1675.00,ACF
BAR/CUR,BARRAL CURVO ALUMINIO (FERRETERIA),2226.00,ACF
FIX,CINTA AISLADORA RAPIFIX X10 MTS (FERRETERIA),338.00,ACF
SINPAR,"DISCO CORTE ""SINPAR"" 115 MM (FERRETERIA)",199.00,ACF
EMP/TR,CINTA EMPAQUE TRANSPARENTE TF3 (FERRETERIA),375.00,ACF
V1/7,PINCEL V1 (SIN LOGO) 7 CM (GALGO),376.47,ACF
V1/10,PINCEL V1 (SIN LOGO) 10 CM (GALGO),443.81,ACF
V1/15,PINCEL V1 (SIN LOGO) 15 CM (GALGO),543.28,ACF
V1/20,PINCEL V1 (SIN LOGO) 20 CM (GALGO),659.59,ACF
V1/25,PINCEL V1 (SIN LOGO) 25 CM (GALGO),909.04,ACF
V1/30,PINCEL V1 (SIN LOGO) 30 CM (GALGO),1236.00,ACF
G101/5,PINCEL LINEA 101-05 (GALGO),427.37,ACF
G101/7,PINCEL LINEA 101-07 (GALGO),469.26,ACF
G101/10,PINCEL LINEA 101-10 (GALGO),557.25,ACF
G101/15,PINCEL LINEA 101-15 (GALGO),661.99,ACF
G101/20,PINCEL LINEA 101-20 (GALGO),904.45,ACF
G101/25,PINCEL LINEA 101-25 (GALGO),1106.12,ACF
G101/30,PINCEL LINEA 101-30 (GALGO),1508.35,ACF
ONE7,PINCEL LINEA ONE 7 (GALGO),387.18,ACF
ONE10,PINCEL LINEA ONE 10  (GALGO),443.81,ACF
ONE15,PINCEL LINEA ONE 15 (GALGO),589.19,ACF
ONE20,PINCEL LINEA ONE 20 (GALGO),722.33,ACF
ONE25,PINCEL LINEA ONE 25 (GALGO),962.60,ACF
ONE30,PINCEL LINEA ONE 30 (GALGO),1093.56,ACF
GD10,PINCEL LINEA GOLD 10 (GALGO),523.39,ACF
GD15,PINCEL LINEA GOLD 15 (GALGO),769.78,ACF
GD20,PINCEL LINEA GOLD 20 (GALGO),997.80,ACF
GD25,PINCEL LINEA GOLD 25 (GALGO),1323.77,ACF
GD30,PINCEL LINEA GOLD 30 (GALGO),1602.30,ACF
BK42,PINCELETA BLACK-42 (GALGO),1821.14,ACF
BKD,PINCELETA BLACK-DOBLE (GALGO),2176.18,ACF
V240,PINCELETA V2 40 (AZUL) (GALGO),1236.54,ACF
V40D,PINCELETA V2 DOBLE (AZUL) (GALGO),1623.72,ACF
ATG22,RODILLO ANTIGOTA GALGO 22 (GALGO),1602.30,ACF
ATG17,RODILLO ANTIGOTA GALGO 17 (GALGO),1432.42,ACF
CUB,RODILLO CUBREMAS (PELO LARGO) (GALGO),1484.46,ACF
LH22,RODILLO PINCEL LINEA HOGAR 22 (GALGO),1666.57,ACF
LEG/A,LIJA AGUA EL GALGO (GALGO),179.20,ACF
LEG/NP,LIJA NO PAST EL GALGO (GALGO),238.56,ACF
EPG5,RODILLO EPOXI GALGO 5 (GALGO),457.58,ACF
EPG8,RODILLO EPOXI GALGO 8 (GALGO),570.83,ACF
EPG11,RODILLO EPOXI GALGO 11 (GALGO),673.36,ACF
ART7,RODILLO ARTE FOAM 7 (GALGO),661.12,ACF
ART11,RODILLO ARTE FOAM 11 (GALGO),826.40,ACF
LEG/A,"LIJA AGUA ""EL GALGO"" (GALGO)",179.20,ACF
LEG/NP,"LIJA ANTI EMPASTE ""EL GALGO"" (GALGO)",238.56,ACF
REM500,KUBIK REMOVEDOR GEL X1/2 (KUBIK),2190.72,ACF
REM1000,KUBIK REMOVEDOR GEL X1 (KUBIK),3634.40,ACF
CON250,KUBIK CONTACTO X1/4 (KUBIK),1489.60,ACF
CON500,KUBIK CONTACTO X1/2 (KUBIK),2312.80,ACF
CON1000,KUBIK CONTACTO X1 (KUBIK),4183.20,ACF
FOS1000,FOSFATIZANTE X1 KUBIK (KUBIK),3068.80,ACF
KW240,KUWAIT COLORES VARIOS X 240 (KUWAIT),1095.00,ACF
KW440,KUWAIT COLORES VARIOS X 440 (KUWAIT),1662.50,ACF
KW/F240,KUWAIT FLUO X240 (KUWAIT),1918.75,ACF
KW/F440,KUWAIT FLUO X440 (KUWAIT),3237.50,ACF
KW/M240,KUWAIT ORO/BRONCE/COBRE X240 (KUWAIT),1665.00,ACF
KW/M440,KUWAIT ORO/BRONCE/COBRE X440 (KUWAIT),2185.00,ACF
KW/P240,KUWAIT PLATA/CROMADO X240 (KUWAIT),1535.00,ACF
KW/P440,KUWAIT PLATA/CROMADO X440 (KUWAIT),2181.25,ACF
KW/B240,KUWAIT BARNIZ X240 (KUWAIT),1095.00,ACF
KW/B440,KUWAIT BARNIZ X440 (KUWAIT),1662.50,ACF
KW/G240,KUWAIT GRAFITO X240 (KUWAIT),1462.50,ACF
KW/G440,KUWAIT GRAFITO X440 (KUWAIT),2068.75,ACF
KW/AT240,KUWAIT ALTA TEMPERATURA X240 (KUWAIT),1712.50,ACF
KW/AT440,KUWAIT ALTA TEMPERATURA X440 (KUWAIT),2840.00,ACF
KW/EPOXI,RODILLO KUWAIT EPOXI X440 (KUWAIT),2888.75,ACF
KW/SIL,KUWAIT SILICONA RENOV VEHICULOS X240 (KUWAIT),1406.25,ACF
KW/INF,KUWAIT INFLANEUMATICOS X300 (KUWAIT),2612.50,ACF
FDO500,FONDO BLANCO X 1/2 (NETCOLOR),750.36,ACF
FDO1000,FONDO BLANCO X 1 (NETCOLOR),1143.66,ACF
E9532,NETCOLOR BARNIZ MARINO X 0.250 (NETCOLOR),892.32,ACF
E9533,NETCOLOR BARNIZ MARINO X 0.500 (NETCOLOR),1409.76,ACF
E9534,NETCOLOR BARNIZ MARINO X 01 (NETCOLOR),2228.16,ACF
E9535,NETCOLOR BARNIZ MARINO X 04 (NETCOLOR),8091.60,ACF
E0045,PINTURA NETCOLOR ESM SINT SAT BLANCO X 0.250 (NETCOLOR),1139.16,ACF
E0188,PINTURA NETCOLOR ESM SINT SAT BLANCO X 0.500 (NETCOLOR),1655.28,ACF
E0227,PINTURA NETCOLOR ESM SINT SAT BLANCO X 1 (NETCOLOR),2878.92,ACF
E0611,PINTURA NETCOLOR ESM SINT SAT BLANCO X 4 (NETCOLOR),10348.80,ACF
E0692,PINTURA NETCOLOR ESM SINT SAT NEGRO X 0.250 (NETCOLOR),880.44,ACF
E0687,PINTURA NETCOLOR ESM SINT SAT NEGRO X 0.500 (NETCOLOR),1362.24,ACF
E0691,PINTURA NETCOLOR ESM SINT SAT NEGRO X 1 (NETCOLOR),2302.08,ACF
E1338,PINTURA NETCOLOR ESM SINT SAT NEGRO X 4 (NETCOLOR),7273.20,ACF
E0545,PINTURA NETCOLOR ESM SINT BLANCO MATE X 0.250 (NETCOLOR),1176.12,ACF
E0573,PINTURA NETCOLOR ESM SINT BLANCO MATE X 0.500 (NETCOLOR),1983.96,ACF
E0612,PINTURA NETCOLOR ESM SINT BLANCO MATE X 1 (NETCOLOR),3273.60,ACF
E1931,PINTURA NETCOLOR ESM SINT BLANCO MATE X 4 (NETCOLOR),11869.44,ACF
E0191,PINTURA NETCOLOR ESM SINT NEGRO MATE X 0.250 (NETCOLOR),840.84,ACF
E0440,PINTURA NETCOLOR ESM SINT NEGRO MATE X 0.500 (NETCOLOR),1261.92,ACF
E0624,PINTURA NETCOLOR ESM SINT NEGRO MATE X 1 (NETCOLOR),2112.00,ACF
E1342,PINTURA NETCOLOR ESM SINT NEGRO MATE X 4 (NETCOLOR),7036.92,ACF
E0668,NETCOLOR ANTIOXIDO ROJO X 0.250 (NETCOLOR),829.89,ACF
E0676,NETCOLOR ANTIOXIDO ROJO X 0.500 (NETCOLOR),1184.04,ACF
E0681,NETCOLOR ANTIOXIDO ROJO X 1 (NETCOLOR),1933.80,ACF
E0780,NETCOLOR ANTIOXIDO ROJO X 4 (NETCOLOR),0.00,ACF
E0237,PINTURA NETCOLOR ESM SINT ALUMINIO X 0.250 (NETCOLOR),0.00,ACF
E0039,PINTURA NETCOLOR ESM SINT ALUMINIO X 0.500 (NETCOLOR),0.00,ACF
E0112,PINTURA NETCOLOR ESM SINT ALUMINIO X 1 (NETCOLOR),0.00,ACF
E0211,PINTURA NETCOLOR ESM SINT AMARILLO X 0.250 (NETCOLOR),1030.92,ACF
E0187,PINTURA NETCOLOR ESM SINT AMARILLO X 0.500 (NETCOLOR),1618.32,ACF
E0042,PINTURA NETCOLOR ESM SINT AMARILLO X 1 (NETCOLOR),2935.68,ACF
E0695,PINTURA NETCOLOR ESM SINT AMARILLO X 4 (NETCOLOR),10599.60,ACF
E0210,PINTURA NETCOLOR ESM SINT BERMELLON X 0.250 (NETCOLOR),1030.92,ACF
E0034,PINTURA NETCOLOR ESM SINT BERMELLON X 0.500 (NETCOLOR),1618.32,ACF
E0041,PINTURA NETCOLOR ESM SINT BERMELLON X 1 (NETCOLOR),2935.68,ACF
E9811,PINTURA NETCOLOR ESM SINT BERMELLON X 4 (NETCOLOR),10599.60,ACF
E0657,PINTURA NETCOLOR ESM SINT BLANCO X 0.250 (NETCOLOR),1030.92,ACF
E0670,PINTURA NETCOLOR ESM SINT BLANCO X 0.500 (NETCOLOR),1618.32,ACF
E0682,PINTURA NETCOLOR ESM SINT BLANCO X 1 (NETCOLOR),2935.68,ACF
E0680,PINTURA NETCOLOR ESM SINT BLANCO X4 (NETCOLOR),10599.60,ACF
E1139,PINTURA NETCOLOR ESM SINT NARANJA X 0.250 (NETCOLOR),1062.60,ACF
E0201,PINTURA NETCOLOR ESM SINT NARANJA X 0.500 (NETCOLOR),1618.32,ACF
E1835,PINTURA NETCOLOR ESM SINT NARANJA X 1 (NETCOLOR),2935.68,ACF
E0738,PINTURA NETCOLOR ESM SINT NARANJA X 4 (NETCOLOR),10599.60,ACF
E0436,PINTURA NETCOLOR ESM SINT AZUL MARINO X 0.250 (NETCOLOR),983.40,ACF
E0291,PINTURA NETCOLOR ESM SINT AZUL MARINO X 0.500 (NETCOLOR),1581.36,ACF
E0376,PINTURA NETCOLOR ESM SINT AZUL MARINO X 1 (NETCOLOR),2534.40,ACF
E0426,PINTURA NETCOLOR ESM SINT AZUL MARINO X 4 (NETCOLOR),0.00,ACF
E0489,PINTURA NETCOLOR ESM SINT AZUL TRAFUL X 0.250 (NETCOLOR),983.40,ACF
E0373,PINTURA NETCOLOR ESM SINT AZUL TRAFUL X 0.500 (NETCOLOR),1581.36,ACF
E0399,PINTURA NETCOLOR ESM SINT AZUL TRAFUL X 1 (NETCOLOR),2534.40,ACF
E0189,PINTURA NETCOLOR ESM SINT AZUL TRAFUL X 4 (NETCOLOR),0.00,ACF
E0835,PINTURA NETCOLOR ESM SINT AZULEJO X 0.250 (NETCOLOR),983.40,ACF
E0621,PINTURA NETCOLOR ESM SINT AZULEJO X 0.500 (NETCOLOR),1581.36,ACF
E1932,PINTURA NETCOLOR ESM SINT AZULEJO X 1 (NETCOLOR),2534.40,ACF
E0374,PINTURA NETCOLOR ESM SINT CREMA X 0.250 (NETCOLOR),983.40,ACF
E0702,PINTURA NETCOLOR ESM SINT CREMA X 0.500 (NETCOLOR),1581.36,ACF
E0437,PINTURA NETCOLOR ESM SINT CREMA X 1 (NETCOLOR),2534.40,ACF
E0471,PINTURA NETCOLOR ESM SINT GRIS ESPACIAL X 0.250 (NETCOLOR),983.40,ACF
E0337,PINTURA NETCOLOR ESM SINT GRIS ESPACIAL X 0.500 (NETCOLOR),1581.36,ACF
E0390,PINTURA NETCOLOR ESM SINT GRIS ESPACIAL X 1 (NETCOLOR),2534.40,ACF
E0473,PINTURA NETCOLOR ESM SINT GRIS HIELO X 0.250 (NETCOLOR),983.40,ACF
E0371,PINTURA NETCOLOR ESM SINT GRIS HIELO X 0.500 (NETCOLOR),1581.36,ACF
E0392,PINTURA NETCOLOR ESM SINT GRIS HIELO X 1 (NETCOLOR),2534.40,ACF
E0693,PINTURA NETCOLOR ESM SINT GRIS HIELO X 4 (NETCOLOR),0.00,ACF
E0620,PINTURA NETCOLOR ESM SINT GRIS OZO X 0.250 (NETCOLOR),983.40,ACF
E0995,PINTURA NETCOLOR ESM SINT MARFIL CHAMP X 0.250 (NETCOLOR),983.40,ACF
E1325,PINTURA NETCOLOR ESM SINT MARFIL CHAMP X 0.500 (NETCOLOR),1581.36,ACF
E1331,PINTURA NETCOLOR ESM SINT MARFIL CHAMP X 1 (NETCOLOR),2534.40,ACF
E0462,PINTURA NETCOLOR ESM SINT MARFIL X 0.250 (NETCOLOR),983.40,ACF
E0303,PINTURA NETCOLOR ESM SINT MARFIL X 0.500 (NETCOLOR),1581.36,ACF
E0381,PINTURA NETCOLOR ESM SINT MARFIL X 1 (NETCOLOR),2534.40,ACF
E1935,PINTURA NETCOLOR ESM SINT VERDE CLARO X 0.250 (NETCOLOR),983.40,ACF
E1937,PINTURA NETCOLOR ESM SINT VERDE CLARO X 0.500 (NETCOLOR),1581.36,ACF
E0393,PINTURA NETCOLOR ESM SINT VERDE CLARO X 1 (NETCOLOR),2534.40,ACF
E1366,PINTURA NETCOLOR ESM SINT VERDE ESMER X 0.250 (NETCOLOR),983.40,ACF
E1938,PINTURA NETCOLOR ESM SINT VERDE ESMER X 0.500 (NETCOLOR),1581.36,ACF
E1843,PINTURA NETCOLOR ESM SINT VERDE ESMER X 1 (NETCOLOR),2534.40,ACF
E1839,PINTURA NETCOLOR ESM SINT VERDE ILUSION X 0.250 (NETCOLOR),983.40,ACF
E1936,PINTURA NETCOLOR ESM SINT VERDE ILUSION X 0.500 (NETCOLOR),1581.36,ACF
E1841,PINTURA NETCOLOR ESM SINT VERDE ILUSION X 1 (NETCOLOR),2534.40,ACF
E0439,PINTURA NETCOLOR ESM SINT VERDE INGLES X 0.250 (NETCOLOR),983.40,ACF
E0290,PINTURA NETCOLOR ESM SINT VERDE INGLES X 0.500 (NETCOLOR),1581.36,ACF
E0375,PINTURA NETCOLOR ESM SINT VERDE INGLES X 1 (NETCOLOR),2534.40,ACF
E1871,PINTURA NETCOLOR ESM SINT VERDE N X 0.500 (NETCOLOR),1581.36,ACF
E1328,PINTURA NETCOLOR ESM SINT VERDE N X 1 (NETCOLOR),2534.40,ACF
E0761,PINTURA NETCOLOR ESM SINT. VERDE NOCHE X 0.250 (NETCOLOR),983.40,ACF
E0531,PINTURA NETCOLOR ESM SINT BEIGE X 0.250 (NETCOLOR),914.76,ACF
E0561,PINTURA NETCOLOR ESM SINT BEIGE X 0.500 (NETCOLOR),1459.92,ACF
E0605,PINTURA NETCOLOR ESM SINT BEIGE X 1 (NETCOLOR),2329.80,ACF
E0655,PINTURA NETCOLOR ESM SINT CASTAÑO X 0.250 (NETCOLOR),914.76,ACF
E0372,PINTURA NETCOLOR ESM SINT CASTAÑO X 0.500 (NETCOLOR),1459.92,ACF
E0574,PINTURA NETCOLOR ESM SINT CASTAÑO X 1 (NETCOLOR),2329.80,ACF
E0134,PINTURA NETCOLOR ESM SINT CEDRO X 0.250 (NETCOLOR),914.76,ACF
E0407,PINTURA NETCOLOR ESM SINT CEDRO X 0.500 (NETCOLOR),1459.92,ACF
E0492,PINTURA NETCOLOR ESM SINT CEDRO X 1 (NETCOLOR),2329.80,ACF
E1866,PINTURA NETCOLOR ESM SINT CELESTE X 0.250 (NETCOLOR),914.76,ACF
E0435,PINTURA NETCOLOR ESM SINT CELESTE X 0.500 (NETCOLOR),1459.92,ACF
E1320,PINTURA NETCOLOR ESM SINT CELESTE X 1 (NETCOLOR),2329.80,ACF
E0991,PINTURA NETCOLOR ESM SINT GRIS PERLA X 0.250 (NETCOLOR),983.40,ACF
E1332,PINTURA NETCOLOR ESM SINT GRIS PERLA X 0.500 (NETCOLOR),1581.36,ACF
E1334,PINTURA NETCOLOR ESM SINT GRIS PERLA X 1 (NETCOLOR),2534.40,ACF
E0629,PINTURA NETCOLOR ESM SINT MARRON X 0.250 (NETCOLOR),914.76,ACF
E0534,PINTURA NETCOLOR ESM SINT MARRON X 0.500 (NETCOLOR),1459.92,ACF
E0572,PINTURA NETCOLOR ESM SINT MARRON X 1 (NETCOLOR),2329.80,ACF
E0630,PINTURA NETCOLOR ESM SINT NEGRO X 0.250 (NETCOLOR),914.76,ACF
E0521,PINTURA NETCOLOR ESM SINT NEGRO X 0.500 (NETCOLOR),1459.92,ACF
E0560,PINTURA NETCOLOR ESM SINT NEGRO X 1 (NETCOLOR),2329.80,ACF
E0599,PINTURA NETCOLOR ESM SINT NEGRO X 4 (NETCOLOR),8587.92,ACF
E1335,PINTURA NETCOLOR ESM SINT OCRE X 0.250 (NETCOLOR),914.76,ACF
E1347,PINTURA NETCOLOR ESM SINT OCRE X 0.500 (NETCOLOR),1459.92,ACF
E1838,PINTURA NETCOLOR ESM SINT OCRE X 1 (NETCOLOR),2329.80,ACF
E0269,PINTURA NETCOLOR ESM SINT TABACO X 0.250 (NETCOLOR),914.76,ACF
E0040,PINTURA NETCOLOR ESM SINT TABACO X 0.500 (NETCOLOR),1459.92,ACF
E0133,PINTURA NETCOLOR ESM SINT TABACO X 1 (NETCOLOR),2329.80,ACF
E0406,PINTURA NETCOLOR ESM SINT VIOLETA X 0.250 (NETCOLOR),960.96,ACF
E0403,PINTURA NETCOLOR ESM SINT VIOLETA X 0.500 (NETCOLOR),1532.52,ACF
E0076,PINTURA NETCOLOR ESM SINT VIOLETA X 1 (NETCOLOR),2445.96,ACF
END/EXT,ENDUIDO EXTERIOR PETROLUX X1 (PETROLUX),1215.00,ACF
END/P1,ENDUIDO INTERIOR PETROLUX X1 (PETROLUX),970.00,ACF
END/P4,ENDUIDO PETROLUX X4 (PETROLUX),2805.00,ACF
FIJ/P1,FIJADOR PETROLUX X1 (PETROLUX),1085.00,ACF
FIJ/P4,FIJADOR PETROLUX X4 (PETROLUX),3365.00,ACF
500101,ESMALTE 3 EN 1 BCO X1/4 (PETROLUX),1002.00,ACF
500102,ESMALTE 3 EN 1 BCO X1/2 (PETROLUX),1642.00,ACF
500103,ESMALTE 3 EN 1 BCO X1 (PETROLUX),2975.00,ACF
500107,BARNIZ INT-EXT X1/4 (PETROLUX),770.00,ACF
500108,BARNIZ INT-EXT X1/2 (PETROLUX),1180.00,ACF
500109,BARNIZ INT-EXT X1 (PETROLUX),2035.00,ACF
500110,PINTURA LATEX PETROLUX INT-EXT X1 (PETROLUX),1530.00,ACF
500111,PINTURA LATEX PETROLUX INT-EXT X4 (PETROLUX),5026.00,ACF
500112,PINTURA LATEX PETROLUX INT-EXT X10 (PETROLUX),11520.00,ACF
500113,PINTURA LATEX PETROLUX INT-EXT X20 (PETROLUX),22265.00,ACF
500114,ESMALTE NEGRO MATE X250 (PETROLUX),891.00,ACF
500115,ESMALTE NEGRO MATE X500 (PETROLUX),1416.00,ACF
500116,ESMALTE NEGRO MATE X1 (PETROLUX),2565.00,ACF
500449,ESMALTE NEGRO MATE X4 (PETROLUX),8760.00,ACF
500117,ESMALTE NEGRO SATINADO X250 (PETROLUX),891.00,ACF
500118,ESMALTE NEGRO SATINADO X500 (PETROLUX),1416.00,ACF
500119,ESMALTE NEGRO SATINADO X1 (PETROLUX),2565.00,ACF
500401,ESMALTE NEGRO SATINADO X4 (PETROLUX),8421.00,ACF
500120,ESMALTE BLANCO SATINADO X1 (PETROLUX),2565.00,ACF
500400,ESMALTE BLANCO SATINADO X4 (PETROLUX),8760.00,ACF
500200,ESMALTE BLANCO MATE X250 (PETROLUX),858.00,ACF
500021,ESMALTE NEGRO BRILLANTEX250 (PETROLUX),850.00,ACF
500022,ESMALTE NEGRO BRILLANTEX500 (PETROLUX),1325.00,ACF
500023,ESMALTE NEGRO BRILLANTE X1 (PETROLUX),2360.00,ACF
500121,ESMALTE GRIS X1 (PETROLUX),2565.00,ACF
500133,ESMALTE GRIS X500 (PETROLUX),1416.00,ACF
500122,ESMALTE CREMA X250 (PETROLUX),891.00,ACF
500123,ESMALTE CREMA X500 (PETROLUX),1416.00,ACF
500124,ESMALTE V/NOCHE X250 (PETROLUX),850.00,ACF
500125,ESMALTE V/NOCHE X1 (PETROLUX),2360.00,ACF
500150,ESMALTE V/ILUSION X1 (PETROLUX),2565.00,ACF
500151,ESMALTE AMARILLO X500 (PETROLUX),1642.00,ACF
500071,ESMALTE MARRON X250 (PETROLUX),850.00,ACF
500126,ESMALTE MARRON X500 (PETROLUX),1325.00,ACF
500127,ESMALTE MARRON X1 (PETROLUX),2360.00,ACF
500041,ESMALTE A.MARINO X250 (PETROLUX),1002.00,ACF
500450,ESMALTE A.MARINO X4 (PETROLUX),10615.00,ACF
500042,ESMALTE MARFIL X1 (PETROLUX),2565.00,ACF
500043,ESMALTE MARFIL X250 (PETROLUX),891.00,ACF
500033,ESMALTE NARANJA X1 (PETROLUX),2565.00,ACF
500031,ESMALTE CEDRO X250 (PETROLUX),891.00,ACF
500231,ESMALTE BERMELLON X250 (PETROLUX),1002.00,ACF
500232,ESMALTE BERMELLON X500 (PETROLUX),1642.00,ACF
500292,ESMALTE G.ESPACIAL X1 (PETROLUX),2463.00,ACF
500293,ESMALTE G.HIELO X1 (PETROLUX),2565.00,ACF
500294,ESMALTE G.HIELO X500 (PETROLUX),1363.00,ACF
500128,ANTIOXIDO X500  (PETROLUX),1155.00,ACF
500129,ESMALTE BLANCO X4 (PETROLUX),10615.00,ACF
500130,ESMALTE NEGRO X4 (PETROLUX),8085.00,ACF
500131,MEMBRANA EN PASTA X1 KG (PETROLUX),1765.00,ACF
500134,MEMBRANA EN PASTA X4 KG (PETROLUX),5355.00,ACF
500132,PINTURA LATEX CIELORRASO X1  (PETROLUX),1270.00,ACF
500433,PINTURA LATEX CIELORRASO X4 (PETROLUX),3935.00,ACF
JAZZ4,"PINTURA LATEX ACRILICO ""JAZZ"" X4 (PETROLUX)",2810.00,ACF
JAZZ10,"PINTURA LATEX ACRILICO ""JAZZ"" X10 (PETROLUX)",5795.00,ACF
JAZZ20,"PINTURA LATEX ACRILICO ""JAZZ"" X20 (PETROLUX)",11225.00,ACF
JAZZ/C4,PINTURA LATEX JAZZ INT-EXT COLORES X4LTS (PETROLUX),5305.00,ACF
JAZZ/C10,PINTURA LATEX JAZZ INT-EXT COLORES X10LTS (PETROLUX),12300.00,ACF
JAZZ/C20,PINTURA LATEX JAZZ INT-EXT COLORES X20 LTS (PETROLUX),23455.00,ACF
500012,FONDO BLANCO P/MADERA X500 (PETROLUX),1155.00,ACF
END1,ENDUIDO X1 (PINTELUX),1356.00,ACF
END4,ENDUIDO X4 (PINTELUX),4176.00,ACF
FIJ1,FIJADOR X1 (PINTELUX),1155.00,ACF
FIJ4,FIJADOR X4 (PINTELUX),3880.00,ACF
LP1,PINTURA LATEX PINTELUX X1 LTS (PINTELUX),2020.00,ACF
LP4,PINTURA LATEX PINTELUX X4 LTS (PINTELUX),7426.00,ACF
LP10,PINTURA LATEX PINTELUX X10 LTS (PINTELUX),17460.00,ACF
LP20,PINTURA LATEX PINTELUX X20 LTS (PINTELUX),33685.00,ACF
LPC1,PINTURA LATEX CIELORRASO PINTELUX X1 LTS (PINTELUX),1537.00,ACF
BSP1,BARNIZ MARINO PINTELUX X 4 LTS (PINTELUX),8485.00,ACF
LUX/C4,PINTURA MAMBA COLOR X4 (PINTELUX),4250.00,ACF
LUX/C10,PINTURA MAMBA COLOR X10 (PINTELUX),8158.00,ACF
LUX/C20,PINTURA MAMBA COLOR X20 (PINTELUX),15705.00,ACF
LUX/L4,PINTURA MAMBA LATEX X4 (PINTELUX),1895.00,ACF
LUX/L10,PINTURA MAMBA LATEX X10 (PINTELUX),3865.00,ACF
LUX/L20,PINTURA MAMBA LATEX X20 (PINTELUX),6963.00,ACF
SCH/M1,BORDEADORA M1 (SCHAFER),26685.00,ACF
SCH/M2,BORDEADORA M2 (SCHAFER),30755.00,ACF
SCH/B1,BARREHOJAS B1 (SCHAFER),1245.00,ACF
SCH/B2,BARREHOJAS B2 (SCHAFER),2225.00,ACF
CAR,CARRETEL SCHAFER (SCHAFER),1476.00,ACF
CARRO,CARRITO P/BORDEADORA SCHAFER (SCHAFER),8565.00,ACF
AT/TEC,"RODILLO RODILLO ANTIGOTA 22 ""TECNOROLL"" (TECNOROLL)",815.00,ACF
LN/TEC,"RODILLO RODILLO LANA NATURAL 22 ""TECNOROLL"" (TECNOROLL)",1311.00,ACF
05PF,RODILLO MINI FORRADO 5 (TECNOROLL),145.00,ACF
08PF,RODILLO MINI FORRADO 8 (TECNOROLL),155.00,ACF
11PF,RODILLO MINI FORRADO 11 (TECNOROLL),163.00,ACF
TC/250,CEMENTO DE CONTACTO X250  (TELPLAST),1438.00,ACF
TC/500,CEMENTO DE CONTACTO X500 (TELPLAST),2240.00,ACF
END/T6,ENDUIDO INTERIOR TELPLAST X600 (TELPLAST),806.00,ACF
END/T1,ENDUIDO INTERIOR TELPLAST X1KG (TELPLAST),1000.00,ACF
FIJ/T1,FIJADOR TELPLAST X1 (TELPLAST),894.00,ACF
MD/T1,"MASILLA DURLOCK TELPLAST X1,7KG (TELPLAST)",1441.00,ACF
MD/T7,MASILLA DURLOCK TELPLAST X7KG (TELPLAST),3341.00,ACF
MD/T15,MASILLA DURLOCK TELPLAST X15KG (TELPLAST),6715.00,ACF
MD/T32,MASILLA DURLOCK TELPLAST X32KG (TELPLAST),12875.00,ACF
TEL125,COLA VINILICA TELPLAST X125 (TELPLAST),435.00,ACF
TEL250,COLA VINILICA TELPLAST X250 (TELPLAST),720.00,ACF
PRO/NEG,PROTECT CARROCERIA NEGRO (TELPLAST),1455.00,ACF
PRO/BCO,PROTECT CARROCERIA BLANCO (TELPLAST),1455.00,ACF
WOW50,ADHESIVO WOW MULTIUSO 50 GR (TELPLAST),696.00,ACF
WOW120,ADHESIVO WOW MULTIUSO 120 GR (TELPLAST),1050.00,ACF
GRIETA,SELLAGRIETAS TELPLAST X400 (TELPLAST),1345.00,ACF
MP400,SELLADOR MULTIPROPOSITO X400 GRS (TELPLAST),1512.00,ACF
M/MAD,MASILLA P/ MADERAS X250 (TELPLAST),435.00,ACF
LIJ/AECO,LIJA AGUA TIGRE (TIGRE),150.00,ACF
LIJ/T,LIJA RUBI TIGRE (TIGRE),106.00,ACF
EXT2,EXTENSOR 2MTS (TIGRE),2220.00,ACF
EXT3,EXTENSOR 3MTS (TIGRE),2850.00,ACF
UNI,RODILLO UNIVERSAL (PELO MEDIO) (),807.65,ACF
BL7,PINCEL BLUE-07 (),0.00,ACF
BL10,PINCEL BLUE-10 (),0.00,ACF
BL15,PINCEL BLUE-15 (),0.00,ACF
BL20,PINCEL BLUE-20 (),0.00,ACF
BL25,PINCEL BLUE-25 (),0.00,ACF
BL30,PINCEL BLUE-30 (),0.00,ACF
MIC4,PINTURA LATEX MICOLOR X4LTS (),765.00,ACF
MIC10,PINTURA LATEX MICOLOR X10LTS (),1551.00,ACF
MICB1,PINTURA ESMALTE SINTETICO BLANCO X1 (),1627.00,ACF
MICB4,PINTURA ESMALTE SINTETICO BLANCO X4 (),6042.00,ACF
MICN1,PINTURA ESMALTE SINTETICO NEGRO X1 (),1522.00,ACF
MICN4,PINTURA ESMALTE SINTETICO NEGRO X4 (),5145.00,ACF
END10,ENDUIDO X10 (),6186.00,ACF
LPC4,PINTURA LATEX CIELORRASO PINTELUX X4 LTS (),3514.00,ACF
LPC10,PINTURA LATEX CIELORRASO PINTELUX X10 LTS (),8215.00,ACF
BMP1,BARNIZ MARINO PINTELUX X 1 LTS (),875.00,ACF
MD1,MASILLA DURLOCK X1 KG (),660.00,ACF
MD4,MASILLA DURLOCK X4 KG (),1915.00,ACF
MD10,MASILLA DURLOCK X10 KG (),4130.00,ACF
MD20,MASILLA DURLOCK X20 KG (),7270.00,ACF
MEM1,MEMBRANA EN PASTA X1 (),1215.00,ACF
MEM4,MEMBRANA EN PASTA X4 (),4470.00,ACF
LEG/R,LIJA RUBI EL GALGO (),53.00,ACF
TK350,PINTURA TEK BOND COLORES X350 (),898.00,ACF
TK200,PINTURA TEK BOND COLORES X200 (),375.08,ACF
TK/B,PINTURA TEK BOND BARNIZ (),614.52,ACF
TK/P,PINTURA TEK BOND PRIMER (),614.52,ACF
TK/AT,PINTURA TEK BOND ALTA TEMPERATURA (),966.60,ACF
TK/F,PINTURA TEK BOND FLUO (),1172.00,ACF
TK/M,PINTURA TEK BOND METALIZADO (),1040.00,ACF
