ACC5008,AGARRADERA CURVA 45 CM,29639.21,INTEGRAL
ACC5007,AGARRADERA RECTA 30 CM,22509.04,INTEGRAL
18039,ALHUE BANERA EXT CON TRANSFERENCIA MONOCOMANDO,105316.54,INTEGRAL
18035,ALHUE BANERA EXT SIN TRANFERENCIA,89518.97,INTEGRAL
18021,ALHUE BIDE MONOCOMANDO,94785.16,INTEGRAL
18005 RT,ALHUE COCINA CISNE C/ROTULA MONOCOMANDO,72989.16,INTEGRAL
18005,ALHUE COCINA CISNE MONOCOMANDO,65732.18,INTEGRAL
18004RT,ALHUE COCINA SOBREMESADA C/ROTULA MONOCOMANDO,60245.84,INTEGRAL
18004,ALHUE COCINA SOBREMESADA MONOCOMANDO,52625.85,INTEGRAL
18016,ALHUE LAVATORIO MONOCOMANDO,57467.74,INTEGRAL
56039,ALUMINE BANERA EXT. CON TRANSF. MONOCOMANDO,110582.24,INTEGRAL
56005,ALUMINE CISNE COCINA CISNE,69191.78,INTEGRAL
56004,ALUMINE COCINA SOBREMESADA,55395.64,INTEGRAL
A56017,ALUMINE LAVATORIO MONOCOMANDO ALTO,123079.14,INTEGRAL
56009,ALUMINE MONOCOMANDO COCINA SOBREMESADA 2 VIAS PLUS,95138.48,INTEGRAL
5020,AQ6000 BIDET,51448.13,INTEGRAL
5001,AQ6000 COCINA DE SOBREMESADA,47740.69,INTEGRAL
5005,AQ6000 COCINA PARED EMBUTIR PICO S,47740.69,INTEGRAL
A5003,AQ6000 COCINA PARED EMBUTIR PICO U (5003),47740.69,INTEGRAL
5002,AQ6000 COCINA PARED EXTERIOR PICO U,53077.23,INTEGRAL
5035,AQ6000 DUCHA,52968.53,INTEGRAL
5030,AQ6000 DUCHA C/TRANF.,70811.93,INTEGRAL
5038,AQ6000 EXTERIOR BANERA LX,77212.08,INTEGRAL
5037,AQ6000 EXTERIOR BANERA SIN TRANSFERENCIA,68673.65,INTEGRAL
5040,AQ6000 EXTERIOR BANERA ST,75541.01,INTEGRAL
5015,AQ6000 LAVATORIO PARED,48914.83,INTEGRAL
5011,AQ6000 LAVATORIO PICO CANO,48914.83,INTEGRAL
5010,AQ6000 LAVATORIO PICO FUNDIDO,49892.95,INTEGRAL
19020,AQ7000 BIDET,51448.13,INTEGRAL
19001,AQ7000 COCINA DE SOBREMESADA,47740.69,INTEGRAL
19004,AQ7000 COCINA PARED EMBUTIR PICO FIJO,53077.27,INTEGRAL
19007,AQ7000 COCINA PARED EXTERIOR PICO J,53077.27,INTEGRAL
19002,AQ7000 COCINA PARED EXTERIOR PICO U,53077.23,INTEGRAL
19035,AQ7000 DUCHA,52968.53,INTEGRAL
19030,AQ7000 DUCHA C/TRANSFERENCIA,70811.94,INTEGRAL
19038,AQ7000 EXTERIOR BANERA LX,77212.08,INTEGRAL
19015,AQ7000 LAVATORIO PARED,48914.83,INTEGRAL
19011,AQ7000 LAVATORIO PICO CANO,48914.83,INTEGRAL
19010,AQ7000 LAVATORIO PICO FUNDIDO,49892.95,INTEGRAL
A92004,AREZZO COCINA MONOC. SOBREMESADA,46837.74,INTEGRAL
92017,AREZZO LAVATORIO ALTO ,92309.32,INTEGRAL
A92005,AREZZO PICO BAR COCINA MONOCOMANDO,56371.95,INTEGRAL
14020,ARUMA  LEVER PLUS BIDET,112103.62,INTEGRAL
A3020,ARUMA CRUZ BIDET,95302.18,INTEGRAL
3001,ARUMA CRUZ COCINA DE SOBREMESADA,67472.28,INTEGRAL
3004,ARUMA CRUZ COCINA PARED EMBUTIR PICO FIJO,72702.47,INTEGRAL
3005,ARUMA CRUZ COCINA PARED EMBUTIR PICO S,66245.49,INTEGRAL
3003,ARUMA CRUZ COCINA PARED EMBUTIR PICO U ,66245.49,INTEGRAL
3007,ARUMA CRUZ COCINA PARED EXTERIOR PICO J,72702.47,INTEGRAL
3006,ARUMA CRUZ COCINA PARED EXTERIOR PICO S,72702.47,INTEGRAL
3002,ARUMA CRUZ COCINA PARED EXTERIOR PICO U,72702.47,INTEGRAL
3030,ARUMA CRUZ DUCHA C/TRANF.,124529.15,INTEGRAL
3035,ARUMA CRUZ DUCHA,99789.14,INTEGRAL
3038,ARUMA CRUZ EXTERIOR BANERA LX,122264.51,INTEGRAL
3040,ARUMA CRUZ EXTERIOR BANERA ST,116441.96,INTEGRAL
3015,ARUMA CRUZ LAVATORIO PARED,92653.9,INTEGRAL
A3010,ARUMA CRUZ LAVATORIO,110610.19,INTEGRAL
4020,ARUMA LEVER BIDET,86637.9,INTEGRAL
4001,ARUMA LEVER COCINA DE SOBREMESADA,67472.28,INTEGRAL
4005,ARUMA LEVER COCINA PARED EMBUTIR PICO S,66245.49,INTEGRAL
4002,ARUMA LEVER COCINA PARED EXTERIOR PICO U,72702.47,INTEGRAL
4030,ARUMA LEVER DUCHA C/TRANF.,122303.69,INTEGRAL
4035,ARUMA LEVER DUCHA,97726.03,INTEGRAL
4040,ARUMA LEVER EXTERIOR BANERA ST,114361.46,INTEGRAL
4015,ARUMA LEVER LAVATORIO PARED,85625.01,INTEGRAL
4010,ARUMA LEVER LAVATORIO,85625.01,INTEGRAL
14030,ARUMA LEVER PLUS DUCHA C/TRANF.,145087.18,INTEGRAL
14010,ARUMA LEVER PLUS LAVATORIO,103384.42,INTEGRAL
9002,AUKAN COCINA,68564.61,INTEGRAL
9010,AUKAN LEVER,77894.87,INTEGRAL
9030,AUKAN LEVER BANERA C/TRANSFERENCIA,106919.54,INTEGRAL
A9020,AUKAN LEVER BIDET,80151.91,INTEGRAL
9004,AUKAN LEVER COCINA PARED EMBUTIR PICO FIJO ,68564.67,INTEGRAL
A9035,AUKAN LEVER DUCHA S/TRANSFERENCIA,86708.76,INTEGRAL
61020,BIDET,170755.38,INTEGRAL
R12050,CABEZAL DE TRANSF.VASTAGO NO ASCEN.,8103.76,INTEGRAL
R22052,CABEZAL TRANSF. VASTAGO ALTO,9561.94,INTEGRAL
R7309,CANO BAJADA ECONOMICO,2430.56,INTEGRAL
ACC5001,CESTO RESIDUOS 5 LTS,37795.76,INTEGRAL
5007,COCINA PARED EXTERIOR PICO J (AQ6000 COCINA),53077.27,INTEGRAL
5006,COCINA PARED EXTERIOR PICO S,53077.23,INTEGRAL
56007,COCINA PARED PICO ALTO ALUMINE,106298.72,INTEGRAL
RL852,CONJUNTO LLUVIA BIDET PLASTICA,2430.56,INTEGRAL
RS852,CONJUNTO SOPAPA,3038.41,INTEGRAL
8001,CUYEN COCINA DE SOBREMESADA,67065.12,INTEGRAL
CD.00.17,DEPOSITO DE APOYO VOGUE PLUS AQUALAF,98598.47,INTEGRAL
28010,DOMO CLASSIC  LAVATORIO PICO FUNDIDO,62714.57,INTEGRAL
28035,DOMO CLASSIC BANO DUCHA,59677.06,INTEGRAL
28020,DOMO CLASSIC BIDET,63551.93,INTEGRAL
28030,DOMOCLASSIC  DUCHA C/TRANF.,78432.14,INTEGRAL
11010,DROP LAVATORIO ,80507.75,INTEGRAL
68030,DUCHA C/TRANF,145087.14,INTEGRAL
61030,DUCHA C/TRANF.,208925.51,INTEGRAL
31039,EXTERIOR BANERA,204164.11,INTEGRAL
ELP044,FLEXIBLE DE GAS 1/2 X 100CM APROBADO LARGO EXTENSIBLE ,25692.76,INTEGRAL
ELP043,FLEXIBLE DE GAS 1/2 X 40CM APROBADO CORTO EXTENSIBLE ,16005.54,INTEGRAL
9001,GRIFERIA AUKAN LEVER COCINA DE MESADA,63111.24,INTEGRAL
4003,GRIFERIA DE PARED PARA COCINA LEVER AQUALAF ARUMA CROMO,66245.49,INTEGRAL
12020,HUILEN BIDET,59762.9,INTEGRAL
12001,HUILEN COCINA DE SOBREMESADA,51493.44,INTEGRAL
12005,HUILEN COCINA PARED EMBUTIR PICO S,51493.44,INTEGRAL
12003,HUILEN COCINA PARED EMBUTIR PICO U,51493.44,INTEGRAL
12002,HUILEN COCINA PARED EXTERIOR PICO U,57221.27,INTEGRAL
12035,HUILEN DUCHA,55459.53,INTEGRAL
12030,HUILEN DUCHA C/TRANSF,73855.32,INTEGRAL
12038,HUILEN EXTERIOR BANERA LX,82109.44,INTEGRAL
12037,HUILEN EXTERIOR BANERA SIN TRANSFERENCIA ,73311.99,INTEGRAL
12040,HUILEN EXTERIOR BANERA ST,80331.75,INTEGRAL
12015,HUILEN LAVATORIO PARED,57796.3,INTEGRAL
12011,HUILEN LAVATORIO PICO CANO,57796.3,INTEGRAL
12010,HUILEN LAVATORIO PICO FUNDIDO,58952.55,INTEGRAL
1001,ITATI CRUZ COCINA DE SOBREMESADA,62016.0,INTEGRAL
1035,ITATI CRUZ DUCHA,80435.33,INTEGRAL
A1030,ITATI CRUZ DUCHA C/TRANSF (1030),106076.69,INTEGRAL
1038,ITATI CRUZ EXTERIOR BANERA LX,104149.4,INTEGRAL
A1040,ITATI CRUZ EXTERIOR BANERA ST (1040),99189.92,INTEGRAL
1015,ITATI CRUZ LAVATORIO PARED,67303.64,INTEGRAL
1011,ITATI CRUZ LAVATORIO PICO CANO,67303.64,INTEGRAL
1010,ITATI CRUZ LAVATORIO PICO FUNDIDO,68649.15,INTEGRAL
A2020,ITATI LEVER BIDET (2020),70742.6,INTEGRAL
2001,ITATI LEVER COCINA DE SOBREMESADA,63208.61,INTEGRAL
2035,ITATI LEVER DUCHA,81982.18,INTEGRAL
2030,ITATI LEVER DUCHA C/TRANSF,108116.62,INTEGRAL
2038,ITATI LEVER EXTERIOR BANERA LX,106152.27,INTEGRAL
2040,ITATI LEVER EXTERIOR BANERA ST,101097.44,INTEGRAL
2015,ITATI LEVER LAVATORIO PARED,68597.94,INTEGRAL
2011,ITATI LEVER LAVATORIO PICO CANO,68597.94,INTEGRAL
2010,ITATI LEVER LAVATORIO PICO FUNDIDO,69969.75,INTEGRAL
16010,LAVATORIO LINEA MAILEN,117245.84,INTEGRAL
A8030,LINEA CUYEN DUCHA CON TRANSFERENCIA,123248.09,INTEGRAL
6020,LIWEN BIDET,61657.85,INTEGRAL
6001,LIWEN COCINA DE SOBREMESADA,55544.77,INTEGRAL
6003,LIWEN COCINA PARED EMBUTIR PICO U,55544.77,INTEGRAL
6002,LIWEN COCINA PARED EXTERIOR PICO U,61930.61,INTEGRAL
6035,LIWEN DUCHA,57896.49,INTEGRAL
A6030,LIWEN DUCHA C/TRANSFERENCIA (6030),76093.47,INTEGRAL
6038,LIWEN EXTERIOR BANERA LX,82367.67,INTEGRAL
6040,LIWEN EXTERIOR BANERA ST,80686.07,INTEGRAL
6015,LIWEN LAVATORIO PARED,59651.62,INTEGRAL
6011,LIWEN LAVATORIO PICO CANO,59651.62,INTEGRAL
6010,LIWEN LAVATORIO PICO FUNDIDO,60844.32,INTEGRAL
52031,LLUVIA ANTICAL. X 100,14560.98,INTEGRAL
52026,LLUVIA CUADRADA X 20 BRAZO CURVO,46328.01,INTEGRAL
52027,LLUVIA CUADRADA X 20 BRAZO RECTO,46435.56,INTEGRAL
52032,LLUVIA ECO X 65,7905.64,INTEGRAL
52029,LLUVIA RED. X 20 BRAZO RECTO,41679.66,INTEGRAL
16020,MAILEN BIDET,128259.65,INTEGRAL
16030,MAILEN DUCHA C/TRANF.,156099.63,INTEGRAL
18010,MONOCOMANDO COCINA,166745.08,INTEGRAL
59005/RO,MONOCOMANDO SOBREMESADA CARTUCHO 40 FLEX COLOR  PICO ROJO / AZUL / NARANJA / BLANCO / NEGRO,113915.01,INTEGRAL
R59005-R,PICO FLEX COLOR ROJO,23068.24,INTEGRAL
R59005-N,PICO MONOC FLEX COLOR NEGRO,23068.24,INTEGRAL
RP51001,PISTON VALVULA HIDRA MAX CLEAN,29543.47,INTEGRAL
58006,PRANZO COCINA GOURMET,351902.73,INTEGRAL
17030,QUILLEN BANO DUCHA C/TRANF.,195124.56,INTEGRAL
17020,QUILLEN BIDET,160324.56,INTEGRAL
17050,QUILLEN DUCHA CON CANO EXT.,249979.82,INTEGRAL
17010,QUILLEN LAVATORIO,146557.29,INTEGRAL
800CR,SET 5 PIEZAS ALEN,68545.99,INTEGRAL
A4007,SET ACCESORIO NOA,52762.29,INTEGRAL
6000,SET GRIFERIA (011+6020+6030),187532.78,INTEGRAL
31021,SPOT BIDE MONOCOMANDO,115848.45,INTEGRAL
A51001 CR,VALVULA HYDRA CROMO AQUALAF,102151.1,INTEGRAL
