316,PENETRIT 10 FUNCIONES X 163 GR,1416.0,MASSOL
318,PENETRIT 10 FUNCIONES X 290 GR,2165.0,MASSOL
302,DESOX. ANTICORROSIVO TRADICIONAL X 163 GR,1714.0,MASSOL
303,DESOX. ANTICORROSIVO TRADICIONAL X 290 GR,2852.0,MASSOL
101,DESOX. ANTICORROSIVO TRADICIONAL ACEITERA X 100 CC,794.0,MASSOL
106,DESOX. ANTICORROSIVO TRADICIONAL X 500 CC,3086.0,MASSOL
103,DESOX. ANTICORROSIVO TRADICIONAL X 1 LT,5927.0,MASSOL
104,DESOX. ANTICORROSIVO TRADICIONAL X 5 LT,25327.0,MASSOL
860,DESENGRASANTE DE ACCIÓN PROFUNDA X 145 GR,1462.0,MASSOL
505,GEL LIMPIADOR INTEGRAL X 500 GR,1228.0,MASSOL
503,GEL LIMPIADOR INTEGRAL X 1 KG,1916.0,MASSOL
504,GEL LIMPIADOR INTEGRAL X 5 KG,6208.0,MASSOL
802,GRAFITO SPRAY AEROSOL X 115 GR,1789.0,MASSOL
801,GRASA BLANCA AEROSOL X 180 GR,2198.0,MASSOL
311,GRASA DE LITIO ROJA AEROSOL X 180 GR,2024.0,MASSOL
402,GRASA DE LITIO ROJA X 100 GR,1107.0,MASSOL
409,GRASA DE LITIO ROJA X 250 GR,2161.0,MASSOL
413,GRASA DE LITIO ROJA X 450 GR,3460.0,MASSOL
405,GRASA DE LITIO ROJA X 1 KG,6652.0,MASSOL
312,GRASA GRAFITADA AEROSOL X 180 GR,1946.0,MASSOL
403,GRASA GRAFITADA X 100 GR,984.0,MASSOL
410,GRASA GRAFITADA X 250 GR,1809.0,MASSOL
414,GRASA GRAFITADA X 450 GR,3076.0,MASSOL
406,GRASA GRAFITADA X 1 KG,5368.0,MASSOL
408,GRASA SUPER LITIO RODAM AMBAR X 100 GR,1141.0,MASSOL
411,GRASA SUPER LITIO RODAM AMBAR X 250 GR,2180.0,MASSOL
415,GRASA SUPER LITIO RODAM AMBAR X 450 GR,3478.0,MASSOL
407,GRASA SUPER LITIO RODAM AMBAR X 1 KG,6762.0,MASSOL
841,LIMPIA CONTACTOS X 200 GR,3021.0,MASSOL
280,"REMOVEDOR DE PARTICULAS ""CHAU POLVO"" X 200 GR",4789.0,MASSOL
281,"ALCOHOL ISOPROPÍLICO ""CHAU POLVO"" X 290 GR",2238.0,MASSOL
325,LUBRICANTE CON PTFE X 163 GR,1920.0,MASSOL
317,LUBRICANTE MULTIUSO X 163 GR,1398.0,MASSOL
322,LUBRICANTE MULTIUSO X 290 GR,2146.0,MASSOL
862,LUBRICANTE SECO X 115 GR,2861.0,MASSOL
852,MECANISMOS DE PRECISIÓN X 170 GR,1902.0,MASSOL
854,PASACABLES X 170 GR,1856.0,MASSOL
803,VASELINA SPRAY X 170 GR,1871.0,MASSOL
961,DESTAPA CAÑERÍAS PENETRIT PLUS X 500 CM3,1056.0,MASSOL
960,DESTAPA CAÑERÍAS PENETRIT PLUS X 1 LT,1667.0,MASSOL
971,QUITA SARRO Y ÓXIDO PENETRIT PLUS X 500 CM3,1078.0,MASSOL
970,QUITA SARRO Y ÓXIDO PENETRIT PLUS X 1 LT,1674.0,MASSOL
980,LIMPIA RESTOS MATERIALES PENETRIT PLUS X 1 LT,1473.0,MASSOL
113,LUBRICANTE MULTIUSO HIDRÁULICO ACEITERA X 100 CM3,619.0,MASSOL
202,LUBRICANTE TEXTIL ACEITERA X 100 CM3,415.0,MASSOL
853,DESLIZA FÁCIL X 170 GR,732.0,MASSOL
401,GRASA AMARILLA X 100 GR,1780.0,MASSOL
412,GRASA AMARILLA X 250 GR,849.0,MASSOL
913,DESTAPA CAÑERÍAS X 500 CM3,1491.0,MASSOL
915,DESTAPA CAÑERÍAS X 1 LT,793.0,MASSOL
919,QUITA SARRO Y ÓXIDO X 500 CM3,1266.0,MASSOL
920,QUITA SARRO Y ÓXIDO X 1 LT,949.0,MASSOL
770,LUBRIC CADENAS (HÚMEDO) ACEITERA X 110 CM3,1297.0,MASSOL
771,LUBRIC CADENAS (SECO) ACEITERA X 110 CM3,1480.0,MASSOL
772,SOLUCIÓN ESPUMA LIMPIADORA X 500 CM3,1425.0,MASSOL
772R,SOLUCIÓN ESPUMA LIMPIADORA REPUESTO X 500 CM3,1202.0,MASSOL
773,DESENGRASANTE ALTO PODER X 500 CM3,3173.0,MASSOL
773R,DESENGRASANTE ALTO PODER REPUIESTO X 500 CM3,2562.0,MASSOL
775,DESENGRASANTE ALTO PODER AEROSOL X 250 GR,2287.0,MASSOL
774,PROTECTOR DE CUADRO X 500 CM3,1836.0,MASSOL
791,CEPILLO DE LIMPIEZA DE CERDAS SUAVES,1499.0,MASSOL
792,CEPILLO DE LIMPIEZA DE CERDAS DURAS,1300.0,MASSOL
795,MANOPLA DE TOALLA MULTIUSOS,1650.0,MASSOL
796,PAÑO DE MICROFIBRA,1589.0,MASSOL
780,LUBRIC CADENAS (TERRENO HÚMEDO) CON BIO-T®,25952.0,MASSOL
781,LUBRIC CADENAS (TERRENO SECO) CON PTFE®,32612.0,MASSOL
782,SOLUCIÓN ESPUMA LIMPIADORA CON SURF-D®,6002.0,MASSOL
783,DESENGRASANTE DE ALTO PODER CON ORANGE-T®,23294.0,MASSOL
784,PROTECTOR DE CUADRO CON TREME-T®,13594.0,MASSOL
797,KIT BIKE BÁSICO MANTEN SECO,5067.0,MASSOL
798,KIT BIKE BÁSICO MANTEN HÚMEDO,4884.0,MASSOL
799,KIT BIKE FULL,15274.0,MASSOL
401,GRASA AMARILLA X 100 GR,849.0,MASSOL
412,GRASA AMARILLA X 250 GR,1491.0,MASSOL
660,LUBRICANTE EN GRASA PARA CADENAS,2530.0,MASSOL
662,LIMPIADOR DE FRENOS,2774.0,MASSOL
663,LIMPIADOR DE CADENAS,2743.0,MASSOL
664,SILICONA BRILLO & PROTECCIÓN  X 212 GR,1827.0,MASSOL
921,POLISH PARA AUTOS X 500 CM3,1819.0,MASSOL
923,SILICONA X 500 CM3,2766.0,MASSOL
924,SILICONA X 250 CM3,1636.0,MASSOL
925,REVIVIDOR DE NEGRO X 500 CM3,1453.0,MASSOL
928,SHAMPOO PARA AUTOS X 500 CM3,1605.0,MASSOL
929,LAVA LUSTRE X 500 CM3,1193.0,MASSOL
930,LAVA PARABRISAS X 500 CM3,1667.0,MASSOL
931,SILICONA FRUTAS CÍTRICAS X 260 GR,1972.0,MASSOL
932,SILICONA CAMPOS DE LAVANDA X 260 GR,1972.0,MASSOL
933,SILICONA BOSQUES DEL SUR X 260 GR,1972.0,MASSOL
934,SILICONA MANZANAS VERDES X 260 GR,1972.0,MASSOL
935,SILICONA FLORES SILVESTRES X 260 GR,1972.0,MASSOL
946,SILICONA CEREZAS X 260 GR,1972.0,MASSOL
947,SILICONA VAINILLA PRIDE X 260 GR,1972.0,MASSOL
936,SILICONA PREMIUM X 95 GR,1361.0,MASSOL
937,SILICONA PREMIUM X 260 GR,2094.0,MASSOL
813,CERA ABRILLANTADORA X 280 GR,2461.0,MASSOL
520,PASTA DESENGRASANTE ACC PROFUNDA X 750 GR,1392.0,MASSOL
521,"PASTA DESENGRASANTE ACC PROFUNDA X 1,5 KG",1942.0,MASSOL
522,PASTA DESENGRASANTE ACC PROFUNDA X 4 KG,4676.0,MASSOL
821,LIMPIA MOTOR X 163 GR,1421.0,MASSOL
822,REMOVEDOR DE ASFALTO Y ALQUITRÁN X 163 GR,1360.0,MASSOL
823,PROTECTOR DE CORREAS X 175 GR,1405.0,MASSOL
855,PENETRIT BURLETES X 175 GR,1260.0,MASSOL
105,LUBRICANTE PARA ARMAS ACEITERA X 100 CM3,886.0,MASSOL
305,LUBRICANTE PARA ARMAS X 163 GR,1573.0,MASSOL
101000,LUBRICANTE MULTIUSO X 163G MECANIC,1355.0,MASSOL
101001,LUBRICANTE MULTIUSO X 290G MECANIC,1843.0,MASSOL
101009,GRASA DE LITIO AEROSOL X 170 G MECANIC,1594.0,MASSOL
101011,GRAFITO POLVO SECO AEROSOL MECAN X 115 G,1846.0,MASSOL
101200,LIMPIA CONTACTO AEROSOL MECANIC X 150 G,1540.0,MASSOL
101201,LIMPIADOR GASEOSO AEROSOL MECANIC X 300GR,6487.0,MASSOL
101202,LIMPIA CONTAC ISOPROPILICO PREMIUM MECANIC X 280 G,4329.0,MASSOL
101303,ARRANCA MOTORES AEROSOL X 260G MOTONIC,2881.0,MASSOL
101304,INFLA REPARA NEUMATICO X 300GR MOTONIC,6964.0,MASSOL
101305,INFLA REPARA NEUMATICO X 150GR MOTONIC,5881.0,MASSOL
101310,SILICONA FRESIAS X 260G MOTONIC,2175.0,MASSOL
101311,SILICONA LIMON X 260G MOTONIC,2201.0,MASSOL
101312,SILICONA MANZANA X 260G MOTONIC,2219.0,MASSOL
101313,SILICONA VAINILLA X 260G MOTONIC,2186.0,MASSOL
101314,SILICONA PINO X 260G MOTONIC,2193.0,MASSOL
101315,SILICONA LAVANDA X 260G MOTONIC,2208.0,MASSOL
101350,LUBRICANTE PARA CINTAS DE CORRER X 220G,3093.0,MASSOL
101450,LUBRICANTE PARA CAÑOS X 240GR MECANIC,1713.0,MASSOL
101500,ACEITERA MULTIUSO X 100 ML MECANIC,448.0,MASSOL
101510,GRASA DE LITIO ROJA EP2 X 100 GR,574.0,MASSOL
101511,GRASA DE LITIO ROJA EP2 X 250 GR,1115.0,MASSOL
101512,GRASA DE LITIO ROJA EP2 X 450 GR,1886.0,MASSOL
101513,GRASA DE LITIO ROJA EP2 X 800 GR,2954.0,MASSOL
101520,GRASA GRAFITADA X 100 GR,690.0,MASSOL
101530,GRASA DE RODAMIENTO X 100GR,624.0,MASSOL
101550,GRASA VASELINADA X 100 GR,583.0,MASSOL
112000,POLIURETANO X 300ML / 200GR ADHEMATIC,2594.0,MASSOL
112002,POLIURETANO X 500ML / 420GR ADHEMATIC,2594.0,MASSOL
101324,LIMPIA INYECTORES Y MARIPOSAS MOTONIC X 290GR,4141.0,MASSOL
